{
  "generated_at": "2026-02-04T19:04:16.400Z",
  "category": "geography",
  "count": 6,
  "topics": [
    {
      "slug": "capitals",
      "label": "Capitals"
    },
    {
      "slug": "countries",
      "label": "Countries"
    },
    {
      "slug": "landmarks",
      "label": "Landmarks"
    },
    {
      "slug": "maps",
      "label": "Maps"
    },
    {
      "slug": "us_geography",
      "label": "US Geography"
    },
    {
      "slug": "world_geography",
      "label": "World Geography"
    }
  ],
  "sources_hint": "deterministic slug->label normalization + overrides map"
}
